"TOKEN";"COMMENT";"DO NOT TRANSLATE";CONSTRAINT;"REFTEXT";"CLASSEMENT";"ExisteDansSlayer"
"AlliesName";"Allies Force";"DO NOT TRANSLATE";;"Allies Force";;
"DESAllies";"Allies Force";"DO NOT TRANSLATE";;"A division contains all units of Allies";;
"AxisName";"Axis Force";"DO NOT TRANSLATE";;"Axis Force";;
"DESAxis";"Axis Force";"DO NOT TRANSLATE";;"A division contains all units of Axis";;
"AlliesAll";"Allies Force All Units";"DO NOT TRANSLATE";;"Allies Force All Units";;
"AlliesAll";"Allies Force All Units";"DO NOT TRANSLATE";;"A division contains all units";;
"AxisAll";"Axis Force All Units";"DO NOT TRANSLATE";;"Axis Force All Units";;
"AxisAll";"Axis Force All Units";"DO NOT TRANSLATE";;"A division contains all units";;
